{
 "as_of": null,
 "athletes": [],
 "challenges": [],
 "clubs": [],
 "comments": [],
 "connected": false,
 "domain": "social",
 "events": [],
 "fixture": "empty",
 "flags": [],
 "follows": [],
 "generated_at": null,
 "kudos": [],
 "posts": [],
 "schema_version": "1.0.0",
 "segment_efforts": [],
 "source": null,
 "status": "missing"
}
